"University","Title","Abstract","Relevance Score","Publication URL","Coordinates"
"""Brunel_University_London""","""Perceptual impact of environmental factors in sighted and visually impaired individualsBritish Journal of Visual Impairment - Olinkha Gustafson-Pearce, Eric Billett, Franjo Cecelja, 2005""","""PDF\nAbstract\nTo a visually impaired individual the physical world presents many challenges.                     For a person with impaired sight, way finding through a complex environment is                     fraught with dangers, both actual and imagined. The current generation of                     mobility aids have the possibility of addressing a broad range of physical                     issues through technological solutions. The perception of difficulty, however,                     can mean that many visually impaired individuals are fearful or uncomfortable                     about independent mobility or travel. In this context it becomes necessary to                     discover exactly what environments, environmental factors or items constitute a                     ‘perception of difficulty’ in the individual’s                     mental landscape and may trigger a negative responsebeforethey interact with the physical environment. This article reports on research                     that sought to ascertain what levels of perceptual difficulties specific                     environments and factors presented to individuals. The research was conducted                     with both visually impaired and sighted groups and compared differences and                     similarities in perceptual difficulty between these two groups.\nBarfield, W.                 ,                      Mann, S.                 ,                      Baird, K.                 ,                      Gemperle, F.                 ,                      Kasabach, C.                 ,                      Stivoric, J.                 ,                      Bauer, M.                 ,                      Martin, R. &.                      Cho, G.                  (2001) Computational Clothing and Accessories in Fundamentals                     of Wearable Computers and Augmented Reality. Hillsdale, NJ: Lawrence Erlbaum Associates . Google Scholar\nFermuller, C. & Aloimonos, Y.                  (1995) ‘Vision and Action’ , Image and Vision Computing 13(10). Google Scholar , Crossref\nGaraj, V.                  (2001) ‘The Brunel Navigation System for the                     Blind: Determination of the Appropriate Position to Mount the External GPS                     Antenna on the User’s Body’, ION GPS                 2000, Salt Lake City, Utah, USA . Google Scholar\nGaraj, V.                 ,                      Jirawimut, R.                 ,                      Ptasinski, P.                 ,                      Cecelja, F. & Balachandran, W.                  (2003) ‘A System for Remote Sighted Guidance of Visually Impaired Pedestrian’ , British Journal of Visual Impairment 21(2). Google Scholar , Link\nJirawimut, R.                 ,                      Prakoonwit, S.                 ,                      Cecelja, F. & Balachandran, W.                  (2003a) ‘Visual Odometer for Pedestrian Navigation’ , IEEE Transactions on Instrumentation and Measurement 52(4): 1166-1173 . Google Scholar , Crossref\nJirawimut, R.                 ,                      Ptasinski, P.                 ,                      Garaj, V.                 ,                      Cecelja, F. & Balachandran, W.                  (2003b) ‘A Method for Dead Reckoning Parameter Correction in Pedestrian                         Navigation System’ , IEEE Transactions on Instrumentation and Measurement 52(1). Google Scholar , Crossref\nJohnson, V.                  and                      Petrie, H.                  (1998) ‘Travelling Safely: The Problems and Concerns of Blind Pedestrians’ , British Journal of Visual Impairment 16(1): 27-31 . Google Scholar , Link\nKitchen, R. M.                 ,                      Blades, M.                  and                      Golledge, R. G.                  (1997) ‘Understanding Spatial Concepts at the Geographic Scale without                         the Use of Vision’ , Progress in Human Geography 21(2): 225-242 . Google Scholar , Link\nPtasinski, P.                 ,                      Cecelja, F.                  and                      Balachandran, W.                  (2002a) ‘Altitude Aiding for GPS Systems using Elevation Map Datasets’ , The Journal of Navigation 55: 451-462 . Google Scholar , Crossref\nPtasinski, P.                 ,                      Jirawimut, R.                 ,                      Cecelja, F. & Balachandran, W.                  (2002b) ‘Brunel Inverse DGPS Positioning System’ , Journal of the Institute of Navigation 48(4). Google Scholar\nPylyshyn, Z.                  (1999) ‘Is Vision Continuous with Cognition? The Case for Cognitive                         Impenetrability of Visual Perception’ , Behavioural and Brain Sciences 22: 341-423 . Google Scholar , Crossref , Medline\nSarter, N. B.                 ,                      Woods, D. D. & Billings, E. E.                  (1997) ‘Automation                 Surprises’, in                      G. Salvendy                  (ed.) Handbook of Human Factor and Ergonomics (2nd edn). New York: Wiley-Interscience . Google Scholar\nSommers, D.                  (1990) ‘Route Imaging for the Blind: The Use of Guided Imagery to                         Enhance the Mobility Performance of the Congenitally Blind’ , British Journal of Visual Impairment 7(1): 18-20 . Google Scholar , Link\nWoods, D. D.                  (1998) ‘Designs are Hypotheses about how Artifacts Shape Cognition and Collaboration’ , Ergonomics 41(2): 168-173 . Google Scholar , Crossref\n""","0.48294455","""http://journals.sagepub.com/doi/10.1177/0264619605051720""","[-0.472855,51.532848]"
"""Brunel_University_London""","""Wallpaper* City Guides and Gendering the Urban AestheticTourist Studies - Monica Degen, Emma Wainwright, 2010""","""aesthetics , gender , lifestyle , tourist guides\nAshworth, G.J. and Voogd, H. ( 1990) Selling the City: marketing approaches in public sector urban planning. London: Belhaven Press. Google Scholar\nBhattarcharya, D. ( 1997) ‘Mediating India: An analysis of a guidebook’ , Annals of Tourism Research 24(2): 371-89. Google Scholar\nBianchini, F. and Parkinson, M. ( 1993) Cultural Policy and Urban Regeneration. Manchester: Manchester University Press. Google Scholar\nBondi, L. ( 1990) ‘Gender divisions and gentrification: a critique’, Transactions of the Institute of British Geographers, Vol 16, 190-198. Google Scholar , Crossref\nBondi, L. and Rose, E. ( 2003) ‘Constructing gender, constructing the urban: A review of Anglo-American feminist urban geography’, Gender, Place and Culture 10(3): 229-245. Google Scholar , Crossref\nBrownhill, S. ( 2000) ‘Regen(d)eration: Women and urban policy in Britain’ , in J. Darke, S. Ledwith and R. Woods (eds) Women and the City: Visibility and Voice in Urban Space. Basingstoke: Palgrave. Google Scholar\nCosgrove. D. ( 1984) Social formation and symbolic landscape. London: Croon Helm. Google Scholar\nCronin, A. and Hetherington, K. ( 2008) Consuming the Entrepreneurial City: Image, Memory, Spectacle. London. New York: Routledge. Google Scholar\nDepartment of Environment, Transport and Regions ( 1999) Towards an Urban Renaissance. London : ODPM. Google Scholar\nDegen, M. ( 2008) Sensing Cities: Regenerating Public Life in Barcelona and Manchester. London: Routledge . Google Scholar\nDel Casino, V. and Hanna, S.P. ( 2000) ‘Representations and identities in tourism map spaces’ , Progress in Human Geography 24(1): 23-46. Google Scholar , Link\nDel Casino, V. and Hanna, S.P. ( 2006) ‘Beyond The ‘Binaries’: A Methodological Intervention for Interrogating Maps as Representational Practices’, ACME: An International E-Journal for Critical Geographies 4(1): 34-56. Google Scholar\nEade, J. ( 2000) Placing London: From Imperial Capital to Global Capital . London: Berghahn Books. Google Scholar\nEdensor, T. ( 2001) ‘Performing tourism, staging tourism’, Tourist Studies 1(1): 59-81. Google Scholar , Link\nEllis, C. ( 1998) ‘What counts as scholarship in communication? An autoethnographic response’, American Communication Journal 1: 1-5. Google Scholar\nEllis, C. and Bochner, A. ( 2000) ‘Autoethnography, personal narrative, reflexivity: researcher as subject’, pp. 733-768 in N. K. Denzin and Y. S. Lincoln (eds) Handbook of Qualitative Research (second edition). Thousand Oaks: Sage Publications. Google Scholar\nEvans, G. ( 2001) Cultural Planning: An Urban Renaissance? London: Routledge. Google Scholar , Crossref\nFairclough, N. ( 2003) Analysing Discourse: Textual Analysis for Social Research . London: Routledge. Google Scholar\nFeatherstone, M. ( 1991) Consumer Culture and Postmodernism. London: Sage Publications. Google Scholar\nFelski, R. ( 2000) ‘The invention of everyday life’, New Formations 39: 13-32. Google Scholar\nGilbert, D. ( 1999) \""London in all its glory - or how to enjoy London’: Guidebook representations of imperial London’, Journal of Historical Geography 25(3): 279-297. Google Scholar , Crossref\nGolinski, J. ( 1998) Making natural knowledge: constructivism and the history of science. Cambridge: Cambridge University Press. Google Scholar\nGreenberg, M. ( 2000) ‘Branding Cities: A Social History of the Urban Lifestyle Magazine’, Urban Affairs Review 36(2): 228-263. Google Scholar , Link\nGrosz, E. ( 1998) \""Bodies-cities\"", in Pile, S. & Nast, H. (eds) Places through the body. London: Routledge, 42-51. Google Scholar\nHarvey, D. ( 1990) The Condition of Postmodernity. Oxford : Blackwell. Google Scholar\nHarvey, D. ( 2003) Paris: Capital of Modernity. New York : Routledge Google Scholar\nHubbard, P. ( 2004) ‘Revenge and Injustice in the Neoliberal City: Uncovering Masculinist Agendas’, Antipode, 36 (4): 665-686. Google Scholar , Crossref\nHumphreys, M. ( 2005) ‘Getting personal: reflexivity and autoethnographic vignettes’, Qualitative Inquiry 11: 840-860. Google Scholar , Link\nImrie, R. and Raco, M. ( 2003) Urban Renaissance? New Labour, Community and Urban Policy . Bristol: Policy Press. Google Scholar , Crossref\nJacobs, J.M. and Fincher R. ( 1998) ‘Introduction’, pp. 000-000 in R. Fincher and J. M. Jacobs (eds) Cities of Difference. New York: Guilford Press: 1-26. Google Scholar , Crossref\nJohnston, L. ( 2001) ‘(Other) bodies and tourism studies’, Annals of Tourism Research 28: 180-201. Google Scholar , Crossref\nJudd, D. and Fainstein, S. ( 1999) The Tourist City. Yale: Yale University Press. Google Scholar\nJudd, D. ( 2003) ‘Visitors and the Spatial Ecology of the City’ , pp. 000-000 in L. Hoffman et al. (eds) Cities and Visitors: Regulating Cities, Markets and City Space. Oxford: Blackwell Publisher: 23-38. Google Scholar , Crossref\nKearns, G. and Philo, C. ( 1993) Selling Places. Oxford: Pergamon Press. Google Scholar\nKehily, M.J. and Nayak, A. ( 2008) ‘Global femininities: consumption, culture and the significance of place’, Discourse: Studies in the Cultural Politics of Education 29: 325-342. Google Scholar , Crossref\nKing, A. ( 1996) ‘Worlds in the city: Manhattan transfer and the ascendance of spectacular space’, Planning Perspectives 11: 97-114. Google Scholar , Crossref\nLash, S. and Urry, J. ( 1994) Economies of Signs and Spaces. London : Sage Publications. Google Scholar\nLeslie, D. and Reimer, S. ( 2003) ‘Gender, modern design and home consumption’ , Environment and Planning D 21: 293-316. Google Scholar , Link\nMcDowell, L. ( 1997) Capital Culture: Gender at Work in the City Cover Capital Culture: Gender at Work in the City. Oxford: Blackwell Google Scholar\nMcDowell, L. ( 1991) ‘Life without father and Ford: The new gender order of post-Fordism’, Transactions of the Institute of British Geographers 16: 400-419. Google Scholar , Crossref\nMiles, S. and Miles, M. ( 2004) Consuming Cities. Basingstoke: Palgrave. Google Scholar , Crossref\nNead, L. ( 2000) Victorian Babylon: People, Streets and Images in Nineteenth-Century London. Yale: Yale University Press. Google Scholar\nNegrin, L. ( 2006) ‘Ornament and the feminine’, Feminist Theory 7(2): 219-235. Google Scholar , Link\nPaterson, M. ( 2006) Consumption and Everyday Life. London : Routledge. Google Scholar\nPink, S. ( 2009) Doing Sensory Ethnography. London: Sage Publications. Google Scholar , Crossref\nPrice, D. ( 1997) ‘Surveyors and surveyed: photography out and about’ , in L. Wells (ed) Photography: a critical introduction. London: Routledge. pp 65-116. Google Scholar\nPritchard, A. ( 2001) ‘Tourism and representation: A scale for measuring gendered portrayals’, Leisure Studies 20: 79-94. Google Scholar , Crossref\nPritchard, A. and Morgan, N.J. ( 2000a) ‘Privileging the male gaze. Marketing gendered landscapes’, Annals of Tourism Research 27(3): 884-905. Google Scholar , Crossref\nPritchard A., and Morgan N.J. ( 2000b) ‘Constructing tourism landscapes - gender, sexuality and space’, Tourism Geographies 2(2): 115-139. Google Scholar , Crossref\nPostrel, V. ( 2004) The Substance of Style. Harper Perennial : New York. Google Scholar\nRendell, J. ( 2000) ‘Introduction: ‘Gender, space\""’ pp. 000-000 in J. Rendell, B. Penner and I. Borden (eds) Gender Space Architecture . London: Routledge: 101-111. Google Scholar\nRose, G. ( 1993) Feminism and Geography: The Limits to Geographical Knowledge . Cambridge: Polity Press. Google Scholar\nSassen, S. and Roost, F. ( 1999) ‘The City: Strategic Site for the Global Entertainment Industry’, pp. 000-000 in D. Judd and S. Fainstein (eds) The Tourist City. London: Yale University Press: 143-154. Google Scholar\nSmith, N. ( 1987) ‘Of yuppies and housing: Gentrification, social restructuring, and the urban dream’, Environment and Planning D 5: 151-172. Google Scholar , Link\nSmith, M. ( 2006) Tourism, Culture and Regeneration. London: CABI Press. Google Scholar , Crossref\nSpry, T. ( 2001) ‘Performing autoethnography: An embodied methodological praxis’, Qualitative Inquiry 7: 706-732. Google Scholar , Link\nUrry, J. ( 2002) The Tourist Gaze (second edition). London: Sage Publications. Google Scholar\nVisitLondon.com (2009) Key Visitor Statistics. Available at www.visitlondonmediacentre.com/facts_figures/media_facts_sheets/ (accessed 14 April 2009). Google Scholar\nWainwright, E. (2009) ‘Manufacturing space: gendered cityscapes and industrial images in Dundee’, Environment and Planning A 4: 336-352. Google Scholar\nWallpaper* Guide London (2008) London: Phaidon. Google Scholar\nWard, K. ( 1998) Selling Places: The Marketing and Promotion of Towns and Cities 1850-2000. London: Spon. Google Scholar\nWeisman, L.K. ( 2000) ‘Prologue’, in J. Rendell, B. Penner & I. Borden (eds) Gender, space and architecture, an interdisciplinary approach. London: Routledge: 1-5. Google Scholar\nWestwood, S., Pritchard, A. and Morgan, N.J. ( 2000) ‘Gender-blind marketing: businesswomen’s perceptions of airline services’, Tourism Management 21: 353-362. Google Scholar , Crossref\nWilson, E. ( 1991) The Sphinx in the City: Urban Life, the Control of Disorder, and Women. Berkeley: University of California Press. Google Scholar\nWilson, E. ( 2000) ‘The Future of Women’, in J. Darke, S. Ledwith and R. Woods (eds) Women and the City: Visibility and Voice in Urban Space. Basingstoke: Palgrave. Google Scholar\nWolff, J. ( 1985) ‘The invisible flâneuse: Women and the literature of modernity’, Theory, Culture and Society 2(3): 37-46. Google Scholar , Link\nZukin, S. ( 1995) The Culture of Cities. Oxford, Blackwell. Google Scholar\nZukin, S. ( 1998) ‘Urban Lifestyles: Diversity and Standardisation in Spaces of Consumption’, Urban Studies 36 (5/6): 825-839. Google Scholar , Link\nZukin, S. ( 2001) ‘How to create a culture capital: reflections on urban markets and places’, pp. 000-000 in I. Blazwick (ed.) Century City: Art and Culture in the Modern Metropolis. London: Tate Publishing : 258-265. Google Scholar\nZukin, S. ( 2005) Point of Purchase: How Shopping Changed American Culture . New York: Routledge. Google Scholar\n""","0.23630902","""http://journals.sagepub.com/doi/abs/10.1177/1468797611403056""","[-0.472855,51.532848]"
"""Aston_University""","""The challenges of developing an online tool to measure the quality of the passenger experience in a PanEuropean context - Research Explorer : Aston University""","""The challenges of developing an online tool to measure the quality of the passenger experience in a PanEuropean context\nResearch output: Chapter in Book/Report/Conference proceeding › Conference contribution\nAston Business School\nAbstract\nMETPEX is a 3 year, FP7 project which aims to develop a PanEuropean tool to measure the quality of the passenger's experience of multimodal transport. Initial work has led to the development of a comprehensive set of variables relating to different passenger groups, forms of transport and journey stages. This paper addresses the main challenges in transforming the variables into usable, accessible computer based tools allowing for the real time collection of information, across multiple journey stages in different EU countries. Non-computer based measurement instruments will be used to gather information from those who may not have or be familiar with mobile technology. Smartphone-based measurement instruments will also be used, hosted in two applications. The mobile applications need to be easy to use, configurable and adaptable according to the context of use. They should also be inherently interesting and rewarding for the participant, whilst allowing for the collection of high quality, valid and reliable data from all journey types and stages (from planning, through to entry into and egress from different transport modes, travel on public and personal vehicles and support of active forms of transport (e.g. cycling and walking). During all phases of the data collection and processing, the privacy of the participant is highly regarded and is ensured.\n""","1.0038806","""https://research.aston.ac.uk/portal/en/researchoutput/the-challenges-of-developing-an-online-tool-to-measure-the-quality-of-the-passenger-experience-in-a-paneuropean-context(f8ef99ad-b413-4703-9667-6e45062273cd).html""","[-1.888803,52.487018]"
"""University_of_Glasgow""","""The Application of Information and Other Technologies to Improve the Mobility of Blind, Visually Impaired and Deafblind People, Travel Health Informatics And Telehealth  - Enlighten: Publications""","""Enlighten: Publications\nLogin\nIn this section\nThe Application of Information and Other Technologies to Improve the Mobility of Blind, Visually Impaired and Deafblind People, Travel Health Informatics And Telehealth\nHersh, M.A. (2009)     The Application of Information and Other Technologies to Improve the Mobility of Blind, Visually Impaired and Deafblind People, Travel Health Informatics And Telehealth.            In: EFMI Special Topic Conference, Antalya, Turkey, 12-15 Nov 2009,\nFull text not currently available from Enlighten.\n""","1.1325935","""http://eprints.gla.ac.uk/102482/""","[-4.28836,55.871751]"
"""Imperial_College_London""","""The future for in-vehicle information systems: The technology and its impacts - Bell - 2002 - Journal of Advanced Transportation - Wiley Online Library""","""Journal of Advanced Transportation\nThe future for in-vehicle information systems: The technology and its impacts\nAuthors\nMichael G.H. Bell is in the Department of Civil and Environmental Engineering, Imperial College of Science, Technology and Engineering, London, U.K.\nFirst published:\nCited by (CrossRef): 2 articles Check for updates\nCitation tools\nFunding Information\nAbstract\nIn-vehicle information has an important social role to play in improving the efficiency and safety of travel by all modes. In this review, three generations of system are identified. The first generation consists of simple in-vehicle units relying heavily on external data. The second generation has more sophisticated in-vehicle units with colour TFT screens and DVD players for maps and entertainment. The third generation again makes use of external data, using the mobile phone network to download map sections and other data as and when required, thereby obviating the need for beacons and map CDs. For locationing, GPS (and/or Galileo, the European version of GPS) remains the favoured technology. Portable devices offering multi-modal information could improve inter-modal transport efficiency.\n""","0.6073563","""http://onlinelibrary.wiley.com/doi/10.1002/atr.5670360303/abstract""","[-0.178219,51.500505]"
