"University","Title","Abstract","Relevance Score","Publication URL","Coordinates"
"""UCL""","""Iris Publication""","""http://discovery.ucl.ac.uk/1403266/\nAbstract\nOBJECTIVES: To examine the individual and combined associations of unhealthy behaviours (low/intermediate physical activity, consuming fruit and vegetables less than once a day, current smoking/short term ex-smoking, never/former/heavy alcohol drinking), assessed at start of follow-up, with hazard of disability among older French adults and to assess the role of potential mediators, assessed repeatedly, of these associations. DESIGN: Population based cohort study. SETTING: Dijon centre of Three-City study. PARTICIPANTS: 3982 (2410 (60.5%) women) French community dwellers aged 65 or over included during 1999-2001; participants were disability-free at baseline when health behaviours were assessed. MAIN OUTCOME MEASURE: Hierarchical indicator of disability (no, light, moderate, severe) combining data from three disability scales (mobility, instrumental activities of daily living, basic activities of daily living) assessed five times between 2001 and 2012. RESULTS: During the 12 year follow-up, 1236 participants (861 (69.7%) women) developed moderate or severe disability. Interval censored survival analyses (adjusted for age, sex, marital status, and education) showed low/intermediate physical activity (hazard ratio 1.72, 95% confidence interval 1.48 to 2.00), consuming fruit and vegetables less than once a day (1.24, 1.10 to 1.41), and current smoking/short term ex-smoking (1.26, 1.05 to 1.50) to be independently associated with an increased hazard of disability, whereas no robust association with alcohol consumption was found. The hazard of disability increased progressively with the number of unhealthy behaviours independently associated with disability (P<0.001); participants with three unhealthy behaviours had a 2.53 (1.86 to 3.43)-fold increased hazard of disability compared with those with none. Reverse causation bias was verified by excluding participants who developed disability in the first four years of follow-up; these analyses on 890 disability events yielded results similar to those in the main analysis. 30.5% of the association between the unhealthy behaviours score and disability was explained by body mass index, cognitive function, depressive symptoms, trauma, chronic conditions, and cardiovascular disease and its risk factors; the main contributors were chronic conditions and, to a lesser extent, depressive symptoms, trauma, and body mass index. CONCLUSIONS: An unhealthy lifestyle is associated with greater hazard of incident disability, and the hazard increases progressively with the number of unhealthy behaviours. Chronic conditions, depressive symptoms, trauma, and body mass index partially explained this association.\nPublication data is maintained in RPS. Visit https://rps.ucl.ac.uk\n› More search options\n""","0.8898537","""http://iris.ucl.ac.uk/iris/publication/889490/2""",
"""Brunel_University_London""","""A system for remote sighted guidance of visually impaired pedestriansBritish Journal of Visual Impairment - V. Garaj, R. Jirawimut, P. Ptasinski, F. Cecelja, W. Balachandran, 2003""","""PDF\nAbstract\nSighted guidance is arguably the most efficient method for aiding visually impaired pedestrians in mobility. A sighted guide's verbal instructions compensate comprehensively for the insufficiency of visual input in navigation. Moreover, the companionship entails sharing of responsibilities and thus increases the blind traveller's sense of security during a journey. The disadvantages of the sighted guidance are that a sighted guide may not always be available or their presence may not be desirable because it restricts personal independence. This paper presents a novel system for navigation of visually impaired pedestrians, whereby advanced technologies were combined to allow a visually impaired user to remotely access the sighted guidance service. The user can choose when and for how long to use the system. The remote sighted guidance system is enabled by the integration of a remote vision facility with the Global Positioning System, the Geographic Information System and the third generation telecommunication network. A user trial is also reported in which the contribution of the system to the mobility of a visually impaired pedestrian was assessed. The results obtained lead to the conclusion that the remote sighted guidance is potentially a highly usable mobility aid.\nEspinosa, M.A. & Ochaita, E. (1998) 'Using tactile maps to improve the practical spatial knowledge of adults who are blind'. Journal of Visual Impairment and Blindness, 92 (5), 338-45. Google Scholar\nFarmer, L.W. & Smith D.L. (1997) 'Adaptive Technology'. In B. B. Blasch, W. R. Wiener & W. R. Welsh (Eds) Foundations of Orientation and Mobility. 2nd Edition (Chapter 7, pp.231-70). New York: American Foundation for the Blind. Google Scholar\nGaraj, V. (2001) 'The Brunel Navigation System for the Blind: Determination of the appropriate position to mount the external GPS antenna on the user's body'. In Proceedings of the 2001-GPS Technical Meeting. Salt Lake City: Institute of Navigation. Google Scholar\nGuth, D.A. & Rieser, J.J. (1997) 'Perception and the control of locomotion by blind and visually impaired pedestrians'. In B. B. Blasch, W. R. Wiener & W. R. Welsh (Eds) Foundations of Orientation and Mobility. 2nd Edition (Chapter 1, pp.9-38). New York: American Foundation for the Blind. Google Scholar\nHeyes, A.D. (1983) 'The Sonic Pathfinder - a new travel aid for the blind'. In W. J. Perkins (Ed.) High Technology Aids for the Disabled (pp.231-270). London: Butterworth & Co. Google Scholar , Crossref\nHeyes, A.D., Dodds, A.G., Carter, D.D.C. & Howarth, C.I. (1983) 'Evaluation of the mobility of Blind Pedestrians' . In W. J. Perkins (Ed.) High Technology Aids for the Disabled (pp.165-171). London: Butterworth & Co. Google Scholar , Crossref\nJansson, G. (1995) 'Theoretical analysis and literature survey'. In G. Jansson (Ed.) Requirements for Effective Orientation and Mobility by Blind People (Chapter 1, pp. 5-16). London: Royal National Institute of the Blind. Google Scholar\nKang-Tsung, C. (2001) Introduction to Geographic Information Systems . USA: McGraw-Hill. Google Scholar\nKorhonen, J. (2001) Introduction to 3G Mobile Communication. USA: Artech House. Google Scholar\nLoomis, J.M., Golledge, R.G. & Klatzky, R.L. (1998) 'Navigations system for the blind: auditory display modes and guidance'. Presence, 7 (2), 193-203. Google Scholar , Crossref\nMay, M. ( 2002) 'Accessible GPS navigation and digital map information' . In Proceedings of the 10th International Mobility Conference (IMC-10), Warwick. Google Scholar\nParkinson, B. W. & Spilker Jr., J. J. (Eds) (1996) 'Overview of GPS Operation and Design'. In Parkinson, B. W., Spilker Jr., J. J. (Eds) Global Positioning System: Theory and Applications (Volume 1, Chapter 2, pp.29-55). Washington DC: American Institute of Aeronautics and Astronautics. Google Scholar\nPeake, P. & Leonard, J.A. (1971) 'The use of heart-rate as an index of stress in blind pedestrians'. Ergonomics, 14 (2), 189-204. Google Scholar , Crossref , Medline\nPetrie, H., Johnson, V., Strothotte, T., Raab, A., Michel, R., Reichert, L. & Schalt, A. (1997) 'MoBIC: An aid to increase the independent mobility of blind travellers'. The British Journal of Visual Impairment , 15 (2), 63-66. Google Scholar , Link\nShingledecker, C. (1983) 'Measuring the mental effort of blind mobility' . Journal of Visual Impairment and Blindness, 77 (7), 334-39. Google Scholar\nWycherley, R.J. & Nicklin, B.H. (1970) 'The heart rate of blind and sighted pedestrians on a town route'. Ergonomics, 13 (2), 181-92. Google Scholar , Crossref , Medline\n""","1.0","""http://journals.sagepub.com/doi/10.1177/026461960302100204""","[-0.472855,51.532848]"
"""University_of_Greenwich""","""Aircraft Accident Statistics and Knowledge Database: Analyzing Passenger Behavior in Aviation Accidents | Journal of Aircraft""","""Aircraft Accident Statistics and Knowledge Database: Analyzing Passenger Behavior in Aviation Accidents\nSubscribe\nAdding the item to your cart\nYour cart has been updated.\nISSN: 0021-8669\nEISSN: 1533-3868\nYour window on major advances in aircraft, the operation of aircraft, and applications of aircraft technology to other fields.\nSite Tools\nAircraft Accident Statistics and Knowledge Database: Analyzing Passenger Behavior in Aviation Accidents\nEdwin R. Galea\nDavid P. Cooney\nCited by\nDu Hong-bing , Yu Xiao-fang , Feng Zhen-yu .  (2017) Simulation on occupant evacuation during aircraft emergency based on cellular automata. 2017 4th International Conference on Transportation Information and Safety (ICTIS), 716-721.\nFang Zhi-Ming , Lv Wei , Liu Xiao-Dong , Song Wei-Guo .  (2014) Study of Boeing 777 Evacuation Using a Finer-grid Civil Aircraft Evacuation Model. Transportation Research Procedia 2, 246-254\nOnline publication date: 1-Jan-2014.\nMartin Hassel , Bjørn Egil Asbjørnslett , Lars Petter Hole .  (2011) Underreporting of maritime accidents to vessel accident databases. Accident Analysis & Prevention 43:6, 2053-2063\nOnline publication date: 1-Nov-2011.\nYu-Hern Chang , Hui-Hua Yang .  (2011) Cabin safety and emergency evacuation: Passenger experience of flight CI-120 accident. Accident Analysis & Prevention 43:3, 1049-1055\nOnline publication date: 1-May-2011.\nMaría José Piñar-Chelso , Jordi Fernández-Castro .  (2011) A New Scale to Evaluate Disruptive Passenger Management by Cabin Crew. Aviation Psychology and Applied Human Factors 1:1, 21-30\nOnline publication date: 1-Jan-2011.\nAnna-Karin Lindberg , Sven Ove Hansson , Carl Rollenhagen .  (2010) Learning from accidents – What more do we need to know?. Safety Science 48:6, 714-721\nOnline publication date: 1-Jul-2010.\nYu-Hern Chang , Hui-Hua Yang .  (2010) Aviation occupant survival factors: An empirical study of the SQ006 accident. Accident Analysis & Prevention 42:2, 695-703\nOnline publication date: 1-Mar-2010.\n""","1.1629282","""https://arc.aiaa.org/doi/10.2514/1.19388""","[-0.003917,51.484493]"
